"You will be redirected to the Buckaroo website when you place an order.","U wordt doorgestuurd naar de website van Buckaroo wanneer u een bestelling plaatst."
"You will be redirected to the Buckaroo in a few seconds.","U wordt doorgestuurd naar de Buckaroo in een paar seconden."
"The payment has been canceled","De bestelling is geannuleerd"
"Order will be created using the current payment method.","Bestelling zal worden gemaakt met behulp van de huidige betalingswijze."
"Account","Rekeningnummer"
"Account holder name","Naam rekeninghouder"
